{
  "schema_version": "1.2.0",
  "document_id": "doc_01JBQ8Z4K7M3N9P2R5T6V8W0Z3",
  "context_id": "privat",
  "intake": {
    "channel": "drive_inbox",
    "adapter_id": "storage_gdrive",
    "source_external_id": "EXTERNAL_FILE_ID_PLACEHOLDER",
    "original_filename": "scan_20260829_0001.pdf",
    "received_at": "2026-08-29T06:58:12Z",
    "source_event_id": "evt_01JBQ8Z4K7M3N9P2R5T6V8W0XY"
  },
  "file": {
    "mime_type": "application/pdf",
    "size_bytes": 284117,
    "page_count": 3,
    "content_hash": "sha256:aaaaaaaaaaaaaaaaaaaaaaaaaaaaaaaaaaaaaaaaaaaaaaaaaaaaaaaaaaaaaaaa",
    "text_fingerprint": "sha256:bbbbbbbbbbbbbbbbbbbbbbbbbbbbbbbbbbbbbbbbbbbbbbbbbbbbbbbbbbbbbbbb",
    "is_scanned": true,
    "language": "de"
  },
  "status": "filed",
  "processing_stage": {
    "last_completed": "filing",
    "completed_at": "2026-08-29T07:26:40Z",
    "attempt_count": 1
  },
  "review": {
    "required": false
  },
  "classification": {
    "document_type": "Beitragsanpassung",
    "document_type_key": "beitragsanpassung",
    "category_key": "gesundheit_krankenkasse",
    "confidence": 0.96
  },
  "case_ref": {
    "case_id": "cse_01JBQ8Z4K7M3N9P2R5T6V8W1A1",
    "case_number": "V-2026-0042",
    "match_method": "identifier_match",
    "match_confidence": 0.99
  },
  "storage": {
    "adapter_id": "storage_gdrive",
    "target_path": "08_Gesundheit_Krankenkasse/2026",
    "target_external_id": "EXTERNAL_TARGET_FILE_ID_PLACEHOLDER",
    "final_filename": "2026-08-25__Krankenversicherung__Beitragsanpassung__Praemie-2027__V-2026-0042.pdf",
    "filed_at": "2026-08-29T07:26:40Z",
    "filing_action_id": "act_01JBQ8Z4K7M3N9P2R5T6V8W1C1",
    "filing_evidence_id": "evd_01JBQ8Z4K7M3N9P2R5T6V8W1D1"
  },
  "related_documents": [],
  "derived_task_ids": [
    "tsk_01JBQ8Z4K7M3N9P2R5T6V8W1B1"
  ],
  "derived_action_ids": [
    "act_01JBQ8Z4K7M3N9P2R5T6V8W1C1",
    "act_01JBQ8Z4K7M3N9P2R5T6V8W1C2"
  ],
  "extraction_result_ref": "privat.document_extraction:doc_01JBQ8Z4K7M3N9P2R5T6V8W0Z3",
  "analysis_ref": "privat.document_analysis:doc_01JBQ8Z4K7M3N9P2R5T6V8W0Z3",
  "analysis_version": "extract@1.0.0+analyze@1.0.0+rules@1.0.0",
  "created_at": "2026-08-29T06:58:20Z",
  "updated_at": "2026-08-29T07:26:40Z",
  "producer": {
    "producer_type": "workflow",
    "producer_id": "JV-P1-MAIN-document_intake-v1",
    "producer_version": "1.0.0"
  },
  "trace": {
    "trace_id": "tr-20260829-0101",
    "workflow_name": "JV-P1-MAIN-document_intake-v1",
    "workflow_version": "1.0.0"
  }
}